"48BIBZLW","journalArticle","2023","Chen, Ying-Chi; Li, Yi-Ting; Lee, Chin-Lai; Kuo, Yen-Ting; Ho, Chia-Lun; Lin, Wei-Che; Hsu, Ming-Chien; Long, Xizi; Chen, Jia-Sin; Li, Wei-Peng; Su, Chia-Hao; Okamoto, Akihiro; Yeh, Chen-Sheng","Electroactive membrane fusion-liposome for increased electron transfer to enhance radiodynamic therapy","Nature Nanotechnology","","1748-3395","10.1038/s41565-023-01476-2","https://www.nature.com/articles/s41565-023-01476-2","Dynamic therapies have potential in cancer treatments but have limitations in efficiency and penetration depth. Here a membrane-integrated liposome (MIL) is created to coat titanium dioxide (TiO2) nanoparticles to enhance electron transfer and increase radical production under low-dose X-ray irradiation. The exoelectrogenic Shewanella oneidensis MR-1 microorganism presents an innate capability for extracellular electron transfer (EET). An EET-mimicking photocatalytic system is created by coating the TiO2 nanoparticles with the MIL, which significantly enhances superoxide anions generation under low-dose (1 Gy) X-ray activation. The c-type cytochromes-constructed electron channel in the membrane mimics electron transfer to surrounding oxygen. Moreover, the hole transport in the valence band is also observed for water oxidation to produce hydroxyl radicals. The TiO2@MIL system is demonstrated against orthotopic liver tumours in vivo.","2023-12","2024-05-26 17:19:28","2024-05-28 07:46:08","2024-05-26 17:19:28","1492-1501","","12","18","","Nat. Nanotechnol.","","","","","","","","en","2023 The Author(s), under exclusive licence to Springer Nature Limited","","","","www.nature.com","","Publisher: Nature Publishing Group","","/Users/tlin/Zotero/storage/CTYTZH8C/Chen et al. - 2023 - Electroactive membrane fusion-liposome for increas.pdf","","No problem","Nanoparticles; Nanotechnology in cancer; Photocatalysis","","","","","","","","","","","","","","","","","","","","","","","","","","","","","","","","","","","","","","","","","","","","","",""
"JTJ5UPEL","journalArticle","2023","Guo, Zhong; Smutok, Oleh; Ayva, Cagla Ergun; Walden, Patricia; Parker, Jake; Whitfield, Jason; Vickers, Claudia E.; Ungerer, Jacobus P. J.; Katz, Evgeny; Alexandrov, Kirill","Development of epistatic YES and AND protein logic gates and their assembly into signalling cascades","Nature Nanotechnology","","1748-3395","10.1038/s41565-023-01450-y","https://www.nature.com/articles/s41565-023-01450-y","The construction and assembly of artificial allosteric protein switches into information and energy processing networks connected to both biological and non-biological systems is a central goal of synthetic biology and bionanotechnology. However, designing protein switches with the desired input, output and performance parameters is challenging. Here we use a range of reporter proteins to demonstrate that their chimeras with duplicated receptor domains produce YES gate protein switches with large (up to 9,000-fold) dynamic ranges and fast (minutes) response rates. In such switches, the epistatic interactions between largely independent synthetic allosteric sites result in an OFF state with minimal background noise. We used YES gate protein switches based on β-lactamase to develop quantitative biosensors of therapeutic drugs and protein biomarkers. Furthermore, we demonstrated the reconfiguration of YES gate switches into AND gate switches controlled by two different inputs, and their assembly into signalling networks regulated at multiple nodes.","2023-11","2024-05-26 17:19:28","2024-05-28 07:46:14","2024-05-26 17:19:28","1327-1334","","11","18","","Nat. Nanotechnol.","","","","","","","","en","2023 The Author(s), under exclusive licence to Springer Nature Limited","","","","www.nature.com","","Publisher: Nature Publishing Group","","/Users/tlin/Zotero/storage/Q4MAH8Z3/Guo et al. - 2023 - Development of epistatic YES and AND protein logic.pdf","","No problem","Biomedical engineering; Bionanoelectronics; Biosensors; Electrochemistry; Sensors","","","","","","","","","","","","","","","","","","","","","","","","","","","","","","","","","","","","","","","","","","","","","",""
"B47G29FQ","journalArticle","2023","Martin-Baniandres, Pablo; Lan, Wei-Hsuan; Board, Stephanie; Romero-Ruiz, Mercedes; Garcia-Manyes, Sergi; Qing, Yujia; Bayley, Hagan","Enzyme-less nanopore detection of post-translational modifications within long polypeptides","Nature Nanotechnology","","1748-3395","10.1038/s41565-023-01462-8","https://www.nature.com/articles/s41565-023-01462-8","Means to analyse cellular proteins and their millions of variants at the single-molecule level would uncover substantial information previously unknown to biology. Nanopore technology, which underpins long-read DNA and RNA sequencing, holds potential for full-length proteoform identification. We use electro-osmosis in an engineered charge-selective nanopore for the non-enzymatic capture, unfolding and translocation of individual polypeptides of more than 1,200 residues. Unlabelled thioredoxin polyproteins undergo transport through the nanopore, with directional co-translocational unfolding occurring unit by unit from either the C or N terminus. Chaotropic reagents at non-denaturing concentrations accelerate the analysis. By monitoring the ionic current flowing through the nanopore, we locate post-translational modifications deep within the polypeptide chains, laying the groundwork for compiling inventories of the proteoforms in cells and tissues.","2023-11","2024-05-26 17:19:28","2024-05-28 07:45:42","2024-05-26 17:19:28","1335-1340","","11","18","","Nat. Nanotechnol.","","","","","","","","en","2023 The Author(s)","","","","www.nature.com","","Publisher: Nature Publishing Group","","/Users/tlin/Zotero/storage/7987VXXX/Martin-Baniandres et al. - 2023 - Enzyme-less nanopore detection of post-translation.pdf","","No bar","Nanopores; Chemistry","","","","","","","","","","","","","","","","","","","","","","","","","","","","","","","","","","","","","","","","","","","","","",""
"5VHUFLMT","journalArticle","2023","Zhang, Yuebao; Hou, Xucheng; Du, Shi; Xue, Yonger; Yan, Jingyue; Kang, Diana D.; Zhong, Yichen; Wang, Chang; Deng, Binbin; McComb, David W.; Dong, Yizhou","Close the cancer–immunity cycle by integrating lipid nanoparticle–mRNA formulations and dendritic cell therapy","Nature Nanotechnology","","1748-3395","10.1038/s41565-023-01453-9","https://www.nature.com/articles/s41565-023-01453-9","Effective cancer immunotherapy is usually blocked by immunosuppressive factors in the tumour microenvironment, resulting in tumour promotion, metastasis and recurrence. Here we combine lipid nanoparticle–mRNA formulations and dendritic cell therapy (named CATCH) to boost the cancer–immunity cycle via progressive steps to overcome the immunosuppressive tumour microenvironment. Multiple types of sugar-alcohol-derived lipid nanoparticles are conceived to modulate the cancer–immunity cycle. First, one type of lipid nanoparticle containing CD40 ligand mRNA induces robust immunogenic cell death in tumoural tissues, leading to the release of tumour-associated antigens and the expression of CD40 ligand. Next, dendritic cells engineered by another type of lipid nanoparticle encapsulating CD40 mRNA are adoptively transferred, which are then activated by the CD40 ligand molecules in tumoural tissues. This promotes the secretion of multiple cytokines and chemokines, and the upregulation of co-stimulatory molecules on dendritic cells, which are crucial for reprogramming the tumour microenvironment and priming the T-cell responses. After dendritic cells present tumour-associated antigens to T cells, all the above stepwise events contribute to boosting a potent tumour-specific T-cell immunity that eradicates established tumours, suppresses distal lesions and prevents tumour rechallenge.","2023-11","2024-05-26 17:19:28","2024-05-28 07:45:39","2024-05-26 17:19:29","1364-1374","","11","18","","Nat. Nanotechnol.","","","","","","","","en","2023 The Author(s), under exclusive licence to Springer Nature Limited","","","","www.nature.com","","Publisher: Nature Publishing Group","","/Users/tlin/Zotero/storage/76FE9NGX/Zhang et al. - 2023 - Close the cancer–immunity cycle by integrating lip.pdf","","Zero","Drug delivery; Nanoparticles; Nanotechnology in cancer","","","","","","","","","","","","","","","","","","","","","","","","","","","","","","","","","","","","","","","","","","","","","",""
"XI76FUU5","journalArticle","2024","Wang, Wendy Xueyi; Douglas, Travis R.; Zhang, Haiwang; Bhattacharya, Afrin; Rothenbroker, Meghan; Tang, Wentian; Sun, Yu; Jia, Zhengping; Muffat, Julien; Li, Yun; Chou, Leo Y. T.","Universal, label-free, single-molecule visualization of DNA origami nanodevices across biological samples using origamiFISH","Nature Nanotechnology","","1748-3395","10.1038/s41565-023-01449-5","https://www.nature.com/articles/s41565-023-01449-5","Structural DNA nanotechnology enables the fabrication of user-defined DNA origami nanostructures (DNs) for biological applications. However, the role of DN design during cellular interactions and subsequent biodistribution remain poorly understood. Current methods for tracking DN fates in situ, including fluorescent-dye labelling, suffer from low sensitivity and dye-induced artifacts. Here we present origamiFISH, a label-free and universal method for the single-molecule fluorescence detection of DNA origami nanostructures in cells and tissues. origamiFISH targets pan-DN scaffold sequences with hybridization chain reaction probes to achieve 1,000-fold signal amplification. We identify cell-type- and DN shape-specific spatiotemporal distribution patterns within a minute of uptake and at picomolar DN concentrations, 10,000× lower than field standards. We additionally optimize compatibility with immunofluorescence and tissue clearing to visualize DN distribution within tissue cryo-/vibratome sections, slice cultures and whole-mount organoids. Together, origamiFISH enables the accurate mapping of DN distribution across subcellular and tissue barriers for guiding the development of DN-based therapeutics.","2024-01","2024-05-26 17:19:28","2024-05-28 07:44:24","2024-05-26 17:19:29","58-69","","1","19","","Nat. Nanotechnol.","","","","","","","","en","2023 The Author(s), under exclusive licence to Springer Nature Limited","","","","www.nature.com","","Publisher: Nature Publishing Group","","/Users/tlin/Zotero/storage/HNKDPAUK/Wang et al. - 2024 - Universal, label-free, single-molecule visualizati.pdf","","No problem","Drug delivery; Nanoparticles; DNA nanostructures","","","","","","","","","","","","","","","","","","","","","","","","","","","","","","","","","","","","","","","","","","","","","",""
"SYSLACZ9","journalArticle","2023","Seitz, Iris; Saarinen, Sharon; Kumpula, Esa-Pekka; McNeale, Donna; Anaya-Plaza, Eduardo; Lampinen, Vili; Hytönen, Vesa P.; Sainsbury, Frank; Cornelissen, Jeroen J. L. M.; Linko, Veikko; Huiskonen, Juha T.; Kostiainen, Mauri A.","DNA-origami-directed virus capsid polymorphism","Nature Nanotechnology","","1748-3395","10.1038/s41565-023-01443-x","https://www.nature.com/articles/s41565-023-01443-x","Viral capsids can adopt various geometries, most iconically characterized by icosahedral or helical symmetries. Importantly, precise control over the size and shape of virus capsids would have advantages in the development of new vaccines and delivery systems. However, current tools to direct the assembly process in a programmable manner are exceedingly elusive. Here we introduce a modular approach by demonstrating DNA-origami-directed polymorphism of single-protein subunit capsids. We achieve control over the capsid shape, size and topology by employing user-defined DNA origami nanostructures as binding and assembly platforms, which are efficiently encapsulated within the capsid. Furthermore, the obtained viral capsid coatings can shield the encapsulated DNA origami from degradation. Our approach is, moreover, not limited to a single type of capsomers and can also be applied to RNA–DNA origami structures to pave way for next-generation cargo protection and targeting strategies.","2023-10","2024-05-26 17:19:28","2024-05-28 07:48:25","2024-05-26 17:19:29","1205-1212","","10","18","","Nat. Nanotechnol.","","","","","","","","en","2023 The Author(s)","","","","www.nature.com","","Publisher: Nature Publishing Group","","/Users/tlin/Zotero/storage/RPH6TCA7/Seitz et al. - 2023 - DNA-origami-directed virus capsid polymorphism.pdf","","No bar","Nanoparticles; Nanobiotechnology; Nanostructures","","","","","","","","","","","","","","","","","","","","","","","","","","","","","","","","","","","","","","","","","","","","","",""
"V8GHP4HB","journalArticle","2023","Dosta, Pere; Cryer, Alexander M.; Dion, Michelle Z.; Shiraishi, Tsubasa; Langston, Steven P.; Lok, David; Wang, Jianing; Harrison, Sean; Hatten, Tiquella; Ganno, Michelle L.; Appleman, Vicky A.; Taboada, Gonzalo Muñoz; Puigmal, Núria; Ferber, Shiran; Kalash, Santhosh; Prado, Michaela; Rodríguez, Alma L.; Kamoun, Walid S.; Abu-Yousif, Adnan O.; Artzi, Natalie","Investigation of the enhanced antitumour potency of STING agonist after conjugation to polymer nanoparticles","Nature Nanotechnology","","1748-3395","10.1038/s41565-023-01447-7","https://www.nature.com/articles/s41565-023-01447-7","Intravenously administered cyclic dinucleotides and other STING agonists are hampered by low cellular uptake and poor circulatory half-life. Here we report the covalent conjugation of cyclic dinucleotides to poly(β-amino ester) nanoparticles through a cathepsin-sensitive linker. This is shown to increase stability and loading, thereby expanding the therapeutic window in multiple syngeneic tumour models, enabling the study of how the long-term fate of the nanoparticles affects the immune response. In a melanoma mouse model, primary tumour clearance depends on the STING signalling by host cells—rather than cancer cells—and immune memory depends on the spleen. The cancer cells act as a depot for the nanoparticles, releasing them over time to activate nearby immune cells to control tumour growth. Collectively, this work highlights the importance of nanoparticle structure and nano-biointeractions in controlling immunotherapy efficacy.","2023-11","2024-05-26 17:19:28","2024-05-28 07:48:05","2024-05-26 17:19:29","1351-1363","","11","18","","Nat. Nanotechnol.","","","","","","","","en","2023 The Author(s), under exclusive licence to Springer Nature Limited","","","","www.nature.com","","Publisher: Nature Publishing Group","","/Users/tlin/Zotero/storage/IKSWWDY2/Dosta et al. - 2023 - Investigation of the enhanced antitumour potency o.pdf","","Log","Biomaterials; Biotechnology","","","","","","","","","","","","","","","","","","","","","","","","","","","","","","","","","","","","","","","","","","","","","",""
"XQ3UJQGF","journalArticle","2023","Beckham, Jacob L.; van Venrooy, Alexis R.; Kim, Soonyoung; Li, Gang; Li, Bowen; Duret, Guillaume; Arnold, Dallin; Zhao, Xuan; Li, John T.; Santos, Ana L.; Chaudhry, Gautam; Liu, Dongdong; Robinson, Jacob T.; Tour, James M.","Molecular machines stimulate intercellular calcium waves and cause muscle contraction","Nature Nanotechnology","","1748-3395","10.1038/s41565-023-01436-w","https://www.nature.com/articles/s41565-023-01436-w","Intercellular calcium waves (ICW) are complex signalling phenomena that control many essential biological activities, including smooth muscle contraction, vesicle secretion, gene expression and changes in neuronal excitability. Accordingly, the remote stimulation of ICW could result in versatile biomodulation and therapeutic strategies. Here we demonstrate that light-activated molecular machines (MM)—molecules that perform mechanical work on the molecular scale—can remotely stimulate ICW. MM consist of a polycyclic rotor and stator that rotate around a central alkene when activated with visible light. Live-cell calcium-tracking and pharmacological experiments reveal that MM-induced ICW are driven by the activation of inositol-triphosphate-mediated signalling pathways by unidirectional, fast-rotating MM. Our data suggest that MM-induced ICW can control muscle contraction in vitro in cardiomyocytes and animal behaviour in vivo in Hydra vulgaris. This work demonstrates a strategy for directly controlling cell signalling and downstream biological function using molecular-scale devices.","2023-09","2024-05-26 17:19:28","2024-05-28 07:46:26","2024-05-26 17:19:29","1051-1059","","9","18","","Nat. Nanotechnol.","","","","","","","","en","2023 The Author(s), under exclusive licence to Springer Nature Limited","","","","www.nature.com","","Publisher: Nature Publishing Group","","/Users/tlin/Zotero/storage/W8EVZRI8/Beckham et al. - 2023 - Molecular machines stimulate intercellular calcium.pdf","","No problem","Nanobiotechnology; Bionanoelectronics","","","","","","","","","","","","","","","","","","","","","","","","","","","","","","","","","","","","","","","","","","","","","",""
"6MDSPRUF","journalArticle","2023","Deprez, Joke; Verbeke, Rein; Meulewaeter, Sofie; Aernout, Ilke; Dewitte, Heleen; Decruy, Tine; Coudenys, Julie; Van Duyse, Julie; Van Isterdael, Gert; Peer, Dan; van der Meel, Roy; De Smedt, Stefaan C.; Jacques, Peggy; Elewaut, Dirk; Lentacker, Ine","Transport by circulating myeloid cells drives liposomal accumulation in inflamed synovium","Nature Nanotechnology","","1748-3395","10.1038/s41565-023-01444-w","https://www.nature.com/articles/s41565-023-01444-w","The therapeutic potential of liposomes to deliver drugs into inflamed tissue is well documented. Liposomes are believed to largely transport drugs into inflamed joints by selective extravasation through endothelial gaps at the inflammatory sites, known as the enhanced permeation and retention effect. However, the potential of blood-circulating myeloid cells for the uptake and delivery of liposomes has been largely overlooked. Here we show that myeloid cells can transport liposomes to inflammatory sites in a collagen-induced arthritis model. It is shown that the selective depletion of the circulating myeloid cells reduces the accumulation of liposomes up to 50–60%, suggesting that myeloid-cell-mediated transport accounts for more than half of liposomal accumulation in inflamed regions. Although it is widely believed that PEGylation inhibits premature liposome clearance by the mononuclear phagocytic system, our data show that the long blood circulation times of PEGylated liposomes rather favours uptake by myeloid cells. This challenges the prevailing theory that synovial liposomal accumulation is primarily due to the enhanced permeation and retention effect and highlights the potential for other pathways of delivery in inflammatory diseases.","2023-11","2024-05-26 17:19:28","2024-05-28 07:47:31","2024-05-26 17:19:29","1341-1350","","11","18","","Nat. Nanotechnol.","","","","","","","","en","2023 The Author(s), under exclusive licence to Springer Nature Limited","","","","www.nature.com","","Publisher: Nature Publishing Group","","/Users/tlin/Zotero/storage/4SE39L8N/Deprez et al. - 2023 - Transport by circulating myeloid cells drives lipo.pdf","","No problem","Drug delivery; Nanoparticles","","","","","","","","","","","","","","","","","","","","","","","","","","","","","","","","","","","","","","","","","","","","","",""
"ZH79ECNQ","journalArticle","2023","Chuapoco, Miguel R.; Flytzanis, Nicholas C.; Goeden, Nick; Christopher Octeau, J.; Roxas, Kristina M.; Chan, Ken Y.; Scherrer, Jon; Winchester, Janet; Blackburn, Roy J.; Campos, Lillian J.; Man, Kwun Nok Mimi; Sun, Junqing; Chen, Xinhong; Lefevre, Arthur; Singh, Vikram Pal; Arokiaraj, Cynthia M.; Shay, Timothy F.; Vendemiatti, Julia; Jang, Min J.; Mich, John K.; Bishaw, Yemeserach; Gore, Bryan B.; Omstead, Victoria; Taskin, Naz; Weed, Natalie; Levi, Boaz P.; Ting, Jonathan T.; Miller, Cory T.; Deverman, Benjamin E.; Pickel, James; Tian, Lin; Fox, Andrew S.; Gradinaru, Viviana","Adeno-associated viral vectors for functional intravenous gene transfer throughout the non-human primate brain","Nature Nanotechnology","","1748-3395","10.1038/s41565-023-01419-x","https://www.nature.com/articles/s41565-023-01419-x","Crossing the blood–brain barrier in primates is a major obstacle for gene delivery to the brain. Adeno-associated viruses (AAVs) promise robust, non-invasive gene delivery from the bloodstream to the brain. However, unlike in rodents, few neurotropic AAVs efficiently cross the blood–brain barrier in non-human primates. Here we report on AAV.CAP-Mac, an engineered variant identified by screening in adult marmosets and newborn macaques, which has improved delivery efficiency in the brains of multiple non-human primate species: marmoset, rhesus macaque and green monkey. CAP-Mac is neuron biased in infant Old World primates, exhibits broad tropism in adult rhesus macaques and is vasculature biased in adult marmosets. We demonstrate applications of a single, intravenous dose of CAP-Mac to deliver functional GCaMP for ex vivo calcium imaging across multiple brain areas, or a cocktail of fluorescent reporters for Brainbow-like labelling throughout the macaque brain, circumventing the need for germline manipulations in Old World primates. As such, CAP-Mac is shown to have potential for non-invasive systemic gene transfer in the brains of non-human primates.","2023-10","2024-05-26 17:19:28","2024-05-28 07:47:42","2024-05-26 17:19:29","1241-1251","","10","18","","Nat. Nanotechnol.","","","","","","","","en","2023 The Author(s)","","","","www.nature.com","","Publisher: Nature Publishing Group","","/Users/tlin/Zotero/storage/YUKG5YZT/Chuapoco et al. - 2023 - Adeno-associated viral vectors for functional intr.pdf","","No problem","Biotechnology; Nanobiotechnology; Biosensors","","","","","","","","","","","","","","","","","","","","","","","","","","","","","","","","","","","","","","","","","","","","","",""
"ZHHJMTX6","journalArticle","2023","Doolan, Jack A.; Alesbrook, Luke S.; Baker, Karen; Brown, Ian R.; Williams, George T.; Hilton, Kira L. F.; Tabata, Makoto; Wozniakiewicz, Penelope J.; Hiscock, Jennifer R.; Goult, Benjamin T.","Next-generation protein-based materials capture and preserve projectiles from supersonic impacts","Nature Nanotechnology","","1748-3395","10.1038/s41565-023-01431-1","https://www.nature.com/articles/s41565-023-01431-1","Extreme energy-dissipating materials are essential for a range of applications. The military and police force require ballistic armour to ensure the safety of their personnel, while the aerospace industry requires materials that enable the capture, preservation and study of hypervelocity projectiles. However, current industry standards display at least one inherent limitation, such as weight, breathability, stiffness, durability and failure to preserve captured projectiles. To resolve these limitations, we have turned to nature, using proteins that have evolved over millennia to enable effective energy dissipation. Specifically, a recombinant form of the mechanosensitive protein talin was incorporated into a monomeric unit and crosslinked, resulting in a talin shock-absorbing material (TSAM). When subjected to 1.5 km s−1 supersonic shots, TSAMs were shown to absorb the impact and capture and preserve the projectile.","2023-09","2024-05-26 17:19:28","2024-05-28 07:47:21","2024-05-26 17:19:29","1060-1066","","9","18","","Nat. Nanotechnol.","","","","","","","","en","2023 The Author(s)","","","","www.nature.com","","Publisher: Nature Publishing Group","","/Users/tlin/Zotero/storage/C3X4A34V/Doolan et al. - 2023 - Next-generation protein-based materials capture an.pdf","","No bar","Biomaterials; Polymer chemistry","","","","","","","","","","","","","","","","","","","","","","","","","","","","","","","","","","","","","","","","","","","","","",""
